{
  "schema": "opensks.pipeline-graph.v1",
  "id": "image-heavy-product-build",
  "name": "Image-Heavy Product Build",
  "version": 1,
  "entry_nodes": [
    "goal"
  ],
  "nodes": {
    "delegate": {
      "id": "delegate",
      "kind": "delegate",
      "display_name": "Delegate to model",
      "enabled": true,
      "position": {
        "x": 220.0,
        "y": 0.0
      },
      "inputs": {},
      "config": {},
      "retry": {
        "max_attempts": 1,
        "backoff_ms": 0,
        "retryable_reason_codes": []
      },
      "approval": {
        "required": false,
        "scope": "none"
      },
      "hook_refs": []
    },
    "goal": {
      "id": "goal",
      "kind": "goal_input",
      "display_name": "Goal input",
      "enabled": true,
      "position": {
        "x": 0.0,
        "y": 0.0
      },
      "inputs": {},
      "config": {},
      "retry": {
        "max_attempts": 1,
        "backoff_ms": 0,
        "retryable_reason_codes": []
      },
      "approval": {
        "required": false,
        "scope": "none"
      },
      "hook_refs": []
    },
    "image": {
      "id": "image",
      "kind": "image_generate",
      "display_name": "Image generate",
      "enabled": true,
      "position": {
        "x": 220.0,
        "y": 130.0
      },
      "inputs": {},
      "config": {},
      "retry": {
        "max_attempts": 1,
        "backoff_ms": 0,
        "retryable_reason_codes": []
      },
      "approval": {
        "required": false,
        "scope": "none"
      },
      "hook_refs": []
    },
    "seal": {
      "id": "seal",
      "kind": "final_seal",
      "display_name": "Final seal",
      "enabled": true,
      "position": {
        "x": 460.0,
        "y": 0.0
      },
      "inputs": {},
      "config": {},
      "retry": {
        "max_attempts": 1,
        "backoff_ms": 0,
        "retryable_reason_codes": []
      },
      "approval": {
        "required": false,
        "scope": "none"
      },
      "hook_refs": []
    }
  },
  "edges": [
    {
      "id": "edge-goal-image",
      "from": {
        "node_id": "goal",
        "port": "out"
      },
      "to": {
        "node_id": "image",
        "port": "in"
      },
      "kind": "control"
    },
    {
      "id": "edge-image-seal",
      "from": {
        "node_id": "image",
        "port": "out"
      },
      "to": {
        "node_id": "seal",
        "port": "in"
      },
      "kind": "control"
    }
  ],
  "variables": {},
  "policies": {
    "max_parallelism": 1,
    "allow_external_side_effects": false,
    "final_seal_required": true
  },
  "metadata": {
    "description": "Default automatic safe pipeline with one compatible model.",
    "created_by": "opensks-graph",
    "evidence_refs": []
  }
}
