{"entry_nodes":["goal"],"nodes":{"seal":{"retry":{"backoff_ms":0,"max_attempts":1,"retryable_reason_codes":[]},"hook_refs":[],"inputs":{},"position":{"y":0,"x":440},"enabled":true,"id":"seal","approval":{"required":false,"scope":"none"},"config":{},"kind":"final_seal","display_name":"Final seal"},"delegate":{"retry":{"backoff_ms":0,"max_attempts":1,"retryable_reason_codes":[]},"hook_refs":[],"inputs":{},"position":{"y":120,"x":220},"enabled":true,"id":"delegate","approval":{"required":false,"scope":"none"},"config":{},"kind":"delegate","display_name":"Delegate to model"},"goal":{"retry":{"backoff_ms":0,"max_attempts":1,"retryable_reason_codes":[]},"hook_refs":[],"inputs":{},"position":{"y":0,"x":0},"enabled":true,"id":"goal","approval":{"required":false,"scope":"none"},"config":{},"kind":"goal_input","display_name":"Goal input"}},"variables":{},"id":"single-model-safe","edges":[{"to":{"port":"in","node_id":"delegate"},"kind":"control","from":{"port":"out","node_id":"goal"},"id":"edge-goal-delegate"},{"to":{"port":"in","node_id":"seal"},"kind":"control","from":{"port":"out","node_id":"delegate"},"id":"edge-delegate-seal"}],"metadata":{"created_by":"opensks-studio","description":"Graph exported from OpenSKS Graph Editor.","evidence_refs":["studio:graph-editor-export"]},"name":"Single Model Safe","version":1,"schema":"opensks.pipeline-graph.v1","policies":{"max_parallelism":1,"final_seal_required":true,"allow_external_side_effects":false}}